

SQL> alter system set use_bison_parser = true;

Succeed.

SQL> 
SQL> drop function if exists bison_pl_func;

Succeed.

SQL> drop function if exists bison_pl_refcur;

Succeed.

SQL> drop procedure if exists bison_pl_inout_proc;

Succeed.

SQL> drop procedure if exists bison_pl_out_proc;

Succeed.

SQL> drop procedure if exists bison_pl_noarg_proc;

Succeed.

SQL> drop procedure if exists bison_pl_proc;

Succeed.

SQL> drop trigger if exists bison_pl_stmt_trg;

Succeed.

SQL> drop trigger if exists bison_pl_trg;

Succeed.

SQL> drop package body if exists bison_pl_pkg;

Succeed.

SQL> drop package if exists bison_pl_pkg;

Succeed.

SQL> drop table if exists bison_pl_src;

Succeed.

SQL> drop table if exists bison_pl_type_t;

Succeed.

SQL> drop table if exists bison_pl_t;

Succeed.

SQL> 
SQL> create table bison_pl_t(id int, name varchar(32));

Succeed.

SQL> create table bison_pl_src(id int, name varchar(32));

Succeed.

SQL> create table bison_pl_type_t(type varchar(4), id int);

Succeed.

SQL> insert into bison_pl_src values(202, 'merge');

1 rows affected.

SQL> insert into bison_pl_type_t values('T', 1);

1 rows affected.

SQL> 
SQL> create or replace procedure bison_pl_proc(p_id in int) as
  2 begin
  3     insert into bison_pl_t values(p_id, 'proc');
  4     return;
  5 end;
  6 /

Succeed.

SQL> 
SQL> create or replace procedure bison_pl_out_proc(p_id in int, p_out out int) as
  2 begin
  3     p_out := p_id + 10;
  4 end;
  5 /

Succeed.

SQL> 
SQL> create or replace procedure bison_pl_inout_proc(p_value in out int) as
  2 begin
  3     p_value := p_value + 1;
  4 end;
  5 /

Succeed.

SQL> 
SQL> create or replace procedure bison_pl_noarg_proc as
  2 begin
  3     null;
  4 end;
  5 /

Succeed.

SQL> 
SQL> create or replace function bison_pl_func(p_id in int) return int as
  2 begin
  3     return p_id + 1;
  4 end;
  5 /

Succeed.

SQL> 
SQL> create or replace function bison_pl_refcur return sys_refcursor as
  2     rc sys_refcursor;
  3 begin
  4     open rc for select id, name from bison_pl_t;
  5     return rc;
  6 end;
  7 /

Succeed.

SQL> 
SQL> declare
  2     rc sys_refcursor;
  3 begin
  4     rc := bison_pl_refcur;
  5     close rc;
  6 end;
  7 /

PL/SQL procedure successfully completed.

SQL> 
SQL> create or replace package bison_pl_pkg as
  2     procedure p(p_id in int);
  3 end;
  4 /

Succeed.

SQL> 
SQL> create or replace package body bison_pl_pkg as
  2     procedure p(p_id in int) as
  3     begin
  4         insert into bison_pl_t values(p_id, 'pkg');
  5     end;
  6 end;
  7 /

Succeed.

SQL> 
SQL> create or replace trigger bison_pl_trg
  2 before insert on bison_pl_t
  3 for each row
  4 begin
  5     :new.name := 'trg';
  6 end;
  7 /

Succeed.

SQL> 
SQL> create or replace trigger bison_pl_stmt_trg
  2 after update of name or delete on bison_pl_t
  3 begin
  4     null;
  5 end;
  6 /

Succeed.

SQL> 
SQL> call bison_pl_proc(1);

PL/SQL procedure successfully completed.

SQL> exec bison_pl_proc(2);

PL/SQL procedure successfully completed.

SQL> execute bison_pl_proc(3);

PL/SQL procedure successfully completed.

SQL> 
SQL> begin
  2     execute immediate 'insert into bison_pl_t values(30, ''top dynamic'')';
  3 end;
  4 /

PL/SQL procedure successfully completed.

SQL> 
SQL> call bison_pl_pkg.p(7);

PL/SQL procedure successfully completed.

SQL> 
SQL> begin
  2     bison_pl_proc(4);
  3     bison_pl_proc(6);
  4 end;
  5 /

PL/SQL procedure successfully completed.

SQL> 
SQL> begin
  2     bison_pl_proc(4);
  3     execute immediate 'insert into bison_pl_t values(5, ''dynamic'')';
  4 end;
  5 /

PL/SQL procedure successfully completed.

SQL> 
SQL> begin
  2     bison_pl_noarg_proc;
  3 end
  4 /

PL/SQL procedure successfully completed.

SQL> 
SQL> declare
  2     v_id int := 0;
  3     v_required int not null := 1;
  4     v_name varchar(32);
  5     v_id_copy bison_pl_t.id%type;
  6     v_row bison_pl_t%rowtype;
  7     type rec_t is record(id int, name varchar(32));
  8     type rec_opt_t is record(id int not null := 1, name varchar(32) default 'opt');
  9     type refcur_t is ref cursor;
 10     type name_arr_t is varray(4) of varchar(32);
 11     type rec_tab_t is table of rec_t;
 12     v_rec rec_t;
 13     v_rec_opt rec_opt_t;
 14     v_names name_arr_t;
 15     v_recs rec_tab_t;
 16 begin
 17     v_id := bison_pl_func(1);
 18     v_id_copy := v_id;
 19     v_row.id := v_id;
 20     v_row.name := 'rowtype';
 21     v_rec.id := v_id;
 22     v_rec.name := 'record';
 23     v_rec_opt.id := v_required;
 24     v_rec_opt.name := 'record default';
 25     v_name := 'using';
 26 end;
 27 /

PL/SQL procedure successfully completed.

SQL> 
SQL> declare
  2     v_diff interval day to second;
  3     v_precise interval day(2) to second(3);
  4     v_period interval year to month;
  5     v_period_precise interval year(2) to month;
  6 begin
  7     null;
  8 end;
  9 /

PL/SQL procedure successfully completed.

SQL> 
SQL> --error
SQL> declare
  2     v_diff interval day to second;
  3 begin
  4     DBMS_OUTPUT.PUT_LINE('interval');
  5 end;
  6 /

OG-00944, [8:1]PL/SQL(SYS.ANONYMOUS BLOCK) terminated with compiling errors
[4:5] PLC-00828 procedure DBMS_OUTPUT.PUT_LINE does not exist

SQL> 
SQL> declare
  2     v_id int := 0;
  3     v_name varchar(32) := 'using';
  4     v_count int := 0;
  5     type id_tab_t is table of int index by binary_integer;
  6     v_ids id_tab_t;
  7 begin
  8     execute immediate 'insert into bison_pl_t values(:1, :2)' using in v_id, in v_name;
  9     execute immediate 'call bison_pl_out_proc(:1, :2)' using in v_id, out v_count;
 10     execute immediate 'call bison_pl_inout_proc(:1)' using in out v_count;
 11     execute immediate 'select count(*) from bison_pl_t' into v_count;
 12     execute immediate 'select id from bison_pl_t' bulk collect into v_ids;
 13 end;
 14 /

PL/SQL procedure successfully completed.

SQL> 
SQL> declare
  2     type id_tab_t is table of int index by binary_integer;
  3     v_ids id_tab_t;
  4 begin
  5     v_ids(1) := 301;
  6     v_ids(2) := 302;
  7 
  8     forall i in 1..2
  9         insert into bison_pl_t values(v_ids(i), 'forall');
 10 end;
 11 /

PL/SQL procedure successfully completed.

SQL> 
SQL> declare
  2     v_id int := 1;
  3     v_count int := 0;
  4 begin
  5     select count(*) into v_count from bison_pl_t;
  6     with q as (select id from bison_pl_t) select count(*) into v_count from q;
  7 
  8     update bison_pl_t set name = 'updated' where id = v_id;
  9     delete from bison_pl_t where id = -1;
 10     insert into bison_pl_t values(201, 'insert');
 11 
 12     merge into bison_pl_t t
 13     using bison_pl_src s
 14     on (t.id = s.id)
 15     when matched then update set t.name = s.name
 16     when not matched then insert (id, name) values (s.id, s.name);
 17 end;
 18 /

PL/SQL procedure successfully completed.

SQL> 
SQL> declare
  2     v_count int := 0;
  3 begin
  4     select count(*) into v_count from bison_pl_type_t where type = 'T';
  5 end;
  6 /

PL/SQL procedure successfully completed.

SQL> 
SQL> declare
  2     v_id int := 1;
  3     v_count int := 0;
  4 begin
  5     declare
  6         v_nested int := 1;
  7     begin
  8         v_id := v_id + v_nested;
  9     end;
 10 
 11     if v_id > 0 then
 12         null;
 13     elsif v_id = 0 then
 14         null;
 15     else
 16         null;
 17     end if;
 18 
 19     case v_id
 20         when 1 then
 21             null;
 22         when 2 then
 23             null;
 24         else
 25             null;
 26     end case;
 27 
 28     case
 29         when v_id > 0 then
 30             null;
 31         else
 32             null;
 33     end case;
 34 
 35     <<goto_start>>
 36     null;
 37     goto goto_done;
 38     v_id := -100;
 39     <<goto_done>>
 40     null;
 41 
 42     <<block_label>>
 43     begin
 44         null;
 45     end block_label;
 46 
 47     loop
 48         exit;
 49     end loop;
 50 
 51     v_count := 0;
 52     loop
 53         v_count := v_count + 1;
 54         if v_count = 1 then
 55             continue;
 56         end if;
 57         exit;
 58     end loop;
 59 
 60     <<named_loop>>
 61     loop
 62         exit named_loop when v_id > 0;
 63     end loop named_loop;
 64 
 65     while v_count < 2 loop
 66         v_count := v_count + 1;
 67         continue when v_count < 2;
 68     end loop;
 69 
 70     <<while_loop>>
 71     while v_count < 3 loop
 72         v_count := v_count + 1;
 73     end loop while_loop;
 74 
 75     for i in 1..2 loop
 76         v_id := v_id + i;
 77     end loop;
 78 
 79     <<for_loop>>
 80     for i in 1..2 loop
 81         v_id := v_id + i;
 82     end loop for_loop;
 83 
 84     for i in reverse 1..2 loop
 85         v_id := v_id + i;
 86     end loop;
 87 end;
 88 /

PL/SQL procedure successfully completed.

SQL> 
SQL> drop table if exists bison_pl_for_shadow;

Succeed.

SQL> create table bison_pl_for_shadow(a int, b int, c varchar(20));

Succeed.

SQL> 
SQL> create or replace procedure bison_pl_for_shadow_proc(startnum int, endnum int) is
  2     i int := 99;
  3 begin
  4     for i in startnum..endnum loop
  5         insert into bison_pl_for_shadow values(i, i % 10, 'x' || i);
  6     end loop;
  7 end;
  8 /

Succeed.

SQL> 
SQL> call bison_pl_for_shadow_proc(1, 5);

PL/SQL procedure successfully completed.

SQL> select * from bison_pl_for_shadow order by a;

A            B            C                   
------------ ------------ --------------------
1            1            x1                  
2            2            x2                  
3            3            x3                  
4            4            x4                  
5            5            x5                  

5 rows fetched.

SQL> 
SQL> drop procedure bison_pl_for_shadow_proc;

Succeed.

SQL> drop table if exists bison_pl_for_shadow;

Succeed.

SQL> 
SQL> declare
  2     v_id int := 0;
  3     v_name varchar(32);
  4     type id_tab_t is table of int index by binary_integer;
  5     v_ids id_tab_t;
  6     rc sys_refcursor;
  7     cursor c is select id, name from bison_pl_t;
  8     cursor c_ids is select id from bison_pl_t;
  9     cursor c_empty is select id, name from bison_pl_t;
 10     cursor c_arg(p_min in int default 0) is select id, name from bison_pl_t where id >= p_min;
 11     v_crow c%rowtype;
 12 begin
 13     for r in (select id, name from bison_pl_t) loop
 14         v_id := r.id;
 15     end loop;
 16 
 17     for r in c_arg(0) loop
 18         v_name := r.name;
 19     end loop;
 20 
 21     for r in c_arg(coalesce(v_id, 0)) loop
 22         v_name := r.name;
 23     end loop;
 24 
 25     for r in c_empty loop
 26         v_name := r.name;
 27     end loop;
 28 
 29     open c;
 30     fetch c into v_crow;
 31     close c;
 32 
 33     open c;
 34     fetch c into v_id, v_name;
 35     close c;
 36 
 37     open c_ids;
 38     fetch c_ids bulk collect into v_ids limit 10;
 39     close c_ids;
 40 
 41     open c_empty;
 42     fetch c_empty into v_id, v_name;
 43     close c_empty;
 44 
 45     open c_arg(v_id);
 46     fetch c_arg into v_id, v_name;
 47     close c_arg;
 48 
 49     open c_arg(coalesce(v_id, 0));
 50     fetch c_arg into v_id, v_name;
 51     close c_arg;
 52 
 53     open rc for select id, name from bison_pl_t;
 54     close rc;
 55 
 56     open rc for 'select id, name from bison_pl_t where id = :1' using v_id;
 57     close rc;
 58 end;
 59 /

PL/SQL procedure successfully completed.

SQL> 
SQL> declare
  2     e_user exception;
  3 begin
  4     begin
  5         raise e_user;
  6     exception
  7         when e_user then
  8             null;
  9         when others then
 10             raise;
 11     end;
 12 
 13     savepoint bison_pl_sp;
 14     rollback to savepoint bison_pl_sp;
 15     savepoint bison_pl_sp2;
 16     rollback to bison_pl_sp2;
 17     rollback;
 18     commit;
 19 end;
 20 /

PL/SQL procedure successfully completed.

SQL> 
SQL> drop table if exists bison_pl_insert_subq;

Succeed.

SQL> create table bison_pl_insert_subq(id int, total int);

Succeed.

SQL> 
SQL> declare
  2     v_id int := 500;
  3 begin
  4     insert into bison_pl_insert_subq values(v_id, (select count(*) from bison_pl_t));
  5     insert into bison_pl_insert_subq(id, total)
  6         select v_id + 1, count(*) from bison_pl_t;
  7 end;
  8 /

PL/SQL procedure successfully completed.

SQL> 
SQL> drop table if exists bison_pl_insert_subq;

Succeed.

SQL> 
SQL> drop table if exists bison_pl_reload_div_t;

Succeed.

SQL> create table bison_pl_reload_div_t(a number);

Succeed.

SQL> 
SQL> create or replace procedure bison_pl_reload_div_proc as
  2     v_left number := 5;
  3     v_right number := 3;
  4     v_div number := 2;
  5 begin
  6     insert into bison_pl_reload_div_t(a) values(round((v_left - v_right) / v_div * 100, 2));
  7 end;
  8 /

Succeed.

SQL> 
SQL> alter table bison_pl_reload_div_t add b number;

Succeed.

SQL> 
SQL> declare
  2 begin
  3     bison_pl_reload_div_proc;
  4 end;
  5 /

PL/SQL procedure successfully completed.

SQL> 
SQL> select a from bison_pl_reload_div_t;

A                                       
----------------------------------------
100                                     

1 rows fetched.

SQL> 
SQL> drop procedure bison_pl_reload_div_proc;

Succeed.

SQL> drop table if exists bison_pl_reload_div_t;

Succeed.

SQL> 
SQL> drop table if exists bison_pl_char_concat;

Succeed.

SQL> create table bison_pl_char_concat(stage varchar(40), val int, info varchar(100));

Succeed.

SQL> 
SQL> declare
  2     v varchar(100);
  3     c char(1);
  4     vc varchar(1);
  5 begin
  6     c := 'w';
  7     vc := 'w';
  8 
  9     v := '';
 10     v := v || c;
 11     insert into bison_pl_char_concat values('varchar concat char', nvl(length(v), -1), substr(v, 1, 20));
 12 
 13     v := '';
 14     v := v || vc;
 15     insert into bison_pl_char_concat values('varchar concat varchar', nvl(length(v), -1), substr(v, 1, 20));
 16 end;
 17 /

PL/SQL procedure successfully completed.

SQL> 
SQL> select * from bison_pl_char_concat order by stage;

STAGE                                    VAL          INFO                                                            
---------------------------------------- ------------ ----------------------------------------------------------------
varchar concat char                      1            w                                                               
varchar concat varchar                   1            w                                                               

2 rows fetched.

SQL> 
SQL> drop table if exists bison_pl_char_concat;

Succeed.

SQL>
SQL> drop table if exists bison_pl_sql_found_t;

Succeed.

SQL> drop table if exists bison_pl_sql_found_log;

Succeed.

SQL> create table bison_pl_sql_found_t(id int);

Succeed.

SQL> create table bison_pl_sql_found_log(stage varchar(30), val int);

Succeed.

SQL> insert into bison_pl_sql_found_t values(1);

1 rows affected.

SQL>
SQL> create or replace procedure bison_pl_sql_isopen_proc(p_id int) is
  2 begin
  3     delete from bison_pl_sql_found_t where id = p_id;
  4     if SQL%ISOPEN then
  5         insert into bison_pl_sql_found_log values('sql_isopen', 1);
  6     else
  7         insert into bison_pl_sql_found_log values('sql_isopen', 0);
  8     end if;
  9 end;
 10 /

Succeed.

SQL>
SQL> create or replace procedure bison_pl_sql_found_proc(p_id int) is
  2 begin
  3     delete from bison_pl_sql_found_t where id = p_id;
  4     if SQL%FOUND then
  5         insert into bison_pl_sql_found_log values('sql_found', 1);
  6     else
  7         insert into bison_pl_sql_found_log values('sql_found', 0);
  8     end if;
  9 end;
 10 /

Succeed.

SQL>
SQL> declare
  2 begin
  3     bison_pl_sql_isopen_proc(99);
  4     bison_pl_sql_found_proc(1);
  5 end;
  6 /

PL/SQL procedure successfully completed.

SQL>
SQL> select stage, val from bison_pl_sql_found_log order by stage;

STAGE                          VAL
------------------------------ ------------
sql_found                      1
sql_isopen                     0

2 rows fetched.

SQL>
SQL> drop procedure bison_pl_sql_found_proc;

Succeed.

SQL> drop procedure bison_pl_sql_isopen_proc;

Succeed.

SQL> drop table if exists bison_pl_sql_found_log;

Succeed.

SQL> drop table if exists bison_pl_sql_found_t;

Succeed.

SQL>
SQL> drop table if exists bison_pl_cursor_attr_t;

Succeed.

SQL> drop table if exists bison_pl_cursor_attr_log;

Succeed.

SQL> create table bison_pl_cursor_attr_t(id int, note varchar(20));

Succeed.

SQL> create table bison_pl_cursor_attr_log(stage varchar(30), val int);

Succeed.

SQL> insert into bison_pl_cursor_attr_t values(1, 'one');

1 rows affected.

SQL> insert into bison_pl_cursor_attr_t values(2, 'two');

1 rows affected.

SQL>
SQL> create or replace procedure bison_pl_sql_notfound_proc(p_id int) is
  2 begin
  3     update bison_pl_cursor_attr_t set note = note where id = p_id;
  4     if SQL%NOTFOUND then
  5         insert into bison_pl_cursor_attr_log values('sql_notfound', 1);
  6     else
  7         insert into bison_pl_cursor_attr_log values('sql_notfound', 0);
  8     end if;
  9 end;
 10 /

Succeed.

SQL>
SQL> declare
  2 begin
  3     bison_pl_sql_notfound_proc(9);
  4 end;
  5 /

PL/SQL procedure successfully completed.

SQL>
SQL> declare
  2     v_count int;
  3 begin
  4     update bison_pl_cursor_attr_t set note = note where id = 1;
  5     v_count := SQL%ROWCOUNT;
  6     insert into bison_pl_cursor_attr_log values('sql_rowcount', v_count);
  7 end;
  8 /

PL/SQL procedure successfully completed.

SQL>
SQL> declare
  2     cursor c1 is select id from bison_pl_cursor_attr_t order by id;
  3     v_id int;
  4     v_count int;
  5 begin
  6     open c1;
  7     if c1%ISOPEN then
  8         insert into bison_pl_cursor_attr_log values('cursor_isopen', 1);
  9     end if;
 10     fetch c1 into v_id;
 11     if c1%FOUND then
 12         insert into bison_pl_cursor_attr_log values('cursor_found', v_id);
 13     end if;
 14     v_count := c1%ROWCOUNT;
 15     insert into bison_pl_cursor_attr_log values('cursor_rowcount', v_count);
 16     loop
 17         fetch c1 into v_id;
 18         exit when c1%NOTFOUND;
 19     end loop;
 20     insert into bison_pl_cursor_attr_log values('cursor_notfound', 1);
 21     close c1;
 22 end;
 23 /

PL/SQL procedure successfully completed.

SQL>
SQL> declare
  2     rc sys_refcursor;
  3     v_id int;
  4 begin
  5     open rc for select id from bison_pl_cursor_attr_t order by id;
  6     loop
  7         fetch rc into v_id;
  8         exit when rc%NOTFOUND;
  9     end loop;
 10     insert into bison_pl_cursor_attr_log values('refcursor_notfound', 1);
 11     close rc;
 12 end;
 13 /

PL/SQL procedure successfully completed.

SQL>
SQL> create or replace procedure bison_pl_auto_proc is
  2     pragma autonomous_transaction;
  3 begin
  4     insert into bison_pl_cursor_attr_log values('pragma_auto', 1);
  5     commit;
  6 end;
  7 /

Succeed.

SQL>
SQL> declare
  2 begin
  3     bison_pl_auto_proc;
  4 end;
  5 /

PL/SQL procedure successfully completed.

SQL>
SQL> create or replace procedure bison_pl_exception_init_proc is
  2     snapshot_too_old exception;
  3     v_part varchar(130);
  4     pragma exception_init(snapshot_too_old, 715);
  5 begin
  6     v_part := 'pragma_exception_init';
  7     insert into bison_pl_cursor_attr_log values(v_part, 1);
  8 end;
  9 /

Succeed.

SQL>
SQL> begin
  2     bison_pl_exception_init_proc;
  3 end;
  4 /

PL/SQL procedure successfully completed.

SQL>
SQL> drop table if exists bison_pl_cursor_loop_t;

Succeed.

SQL> create table bison_pl_cursor_loop_t(owner varchar(20), table_name varchar(20), partition_name varchar(20));

Succeed.

SQL> insert into bison_pl_cursor_loop_t values('USR', 'TAB', 'P1');

1 rows affected.

SQL>
SQL> create or replace procedure bison_pl_cursor_assign_proc is
  2     v_table varchar(130);
  3     v_part varchar(130);
  4     v_owner varchar(130);
  5 begin
  6     for item in (select owner, table_name, partition_name from bison_pl_cursor_loop_t) loop
  7         v_table := '"'||ITEM.TABLE_NAME||'"';
  8         v_part  := '"'||ITEM.PARTITION_NAME||'"';
  9         v_owner := '"'||ITEM.OWNER||'"';
 10         if v_table = '"TAB"' and v_part = '"P1"' and v_owner = '"USR"' then
 11             insert into bison_pl_cursor_attr_log values('cursor_for_assign', 1);
 12         end if;
 13     end loop;
 14 end;
 15 /

Succeed.

SQL>
SQL> begin
  2     bison_pl_cursor_assign_proc;
  3 end;
  4 /

PL/SQL procedure successfully completed.

SQL>
SQL> select stage, val from bison_pl_cursor_attr_log order by stage;

STAGE                          VAL
------------------------------ ------------
cursor_for_assign              1
cursor_found                   1
cursor_isopen                  1
cursor_notfound                1
cursor_rowcount                1
pragma_auto                    1
pragma_exception_init          1
refcursor_notfound             1
sql_notfound                   1
sql_rowcount                   1

10 rows fetched.

SQL>
SQL> drop procedure bison_pl_cursor_assign_proc;

Succeed.

SQL> drop procedure bison_pl_exception_init_proc;

Succeed.

SQL> drop procedure bison_pl_auto_proc;

Succeed.

SQL> drop procedure bison_pl_sql_notfound_proc;

Succeed.

SQL> drop table if exists bison_pl_cursor_loop_t;

Succeed.

SQL> drop table if exists bison_pl_cursor_attr_log;

Succeed.

SQL> drop table if exists bison_pl_cursor_attr_t;

Succeed.

SQL>
SQL> drop table if exists bison_pl_trig_event_log;

Succeed.

SQL> drop table if exists bison_pl_trig_event_t;

Succeed.

SQL> create table bison_pl_trig_event_t(id int, status varchar(10));

Succeed.

SQL> create table bison_pl_trig_event_log(event_name varchar(10));

Succeed.

SQL> insert into bison_pl_trig_event_t values(1, 'old');

1 rows affected.

SQL>
SQL> create or replace trigger bison_pl_trig_event_trg
  2 after insert or update or delete on bison_pl_trig_event_t
  3 for each row
  4 begin
  5     case
  6         when inserting then
  7             insert into bison_pl_trig_event_log values('insert');
  8         when updating then
  9             insert into bison_pl_trig_event_log values('update');
 10         when deleting then
 11             insert into bison_pl_trig_event_log values('delete');
 12         else
 13             insert into bison_pl_trig_event_log values('other');
 14     end case;
 15 end;
 16 /

Succeed.

SQL> 
SQL> insert into bison_pl_trig_event_t values(2, 'new');

1 rows affected.

SQL> update bison_pl_trig_event_t set status = 'new' where id = 1;

1 rows affected.

SQL> delete from bison_pl_trig_event_t where id = 2;

1 rows affected.

SQL> select event_name, count(*) as cnt from bison_pl_trig_event_log group by event_name order by event_name;

EVENT_NAME CNT
---------- --------------------
delete     1
insert     1
update     1

3 rows fetched.

SQL> select count(*) as updated_rows from bison_pl_trig_event_t where status = 'new';

UPDATED_ROWS
--------------------
1

1 rows fetched.

SQL>
SQL> drop trigger bison_pl_trig_event_trg;

Succeed.

SQL> drop table if exists bison_pl_trig_event_log;

Succeed.

SQL> drop table if exists bison_pl_trig_event_t;

Succeed.

SQL> declare
  2     res varchar2(100);
  3 begin
  4 --  res := dbms_debug.initialize();
  5 exception
  6     when others then
  7         null;
  8 end;
  9 /

PL/SQL procedure successfully completed.

SQL>
SQL> declare
  2     res varchar2(100);
  3 begin
  4     null;
  5 exception
  6     when others then
  7         res := 'handled';
  8 end;
  9 /

PL/SQL procedure successfully completed.

SQL>
SQL> drop table if exists bison_pl_issue245_log;

Succeed.

SQL> create table bison_pl_issue245_log(name varchar(40), val int);

Succeed.

SQL>
SQL> declare
  2     n PLS_INTEGER := 1;
  3 begin
  4     insert into bison_pl_issue245_log values('pls_integer', n);
  5 end;
  6 /

PL/SQL procedure successfully completed.

SQL>
SQL> drop table if exists bison_pls_integer_name_t;

Succeed.

SQL> create table bison_pls_integer_name_t(pls_integer int);

Succeed.

SQL> insert into bison_pls_integer_name_t values(7);

1 rows affected.

SQL> update bison_pls_integer_name_t set pls_integer = pls_integer where pls_integer = 7;

1 rows affected.

SQL> drop table bison_pls_integer_name_t;

Succeed.

SQL>
SQL> declare
  2     first integer := 1;
  3     last integer := 3;
  4     high integer := 10;
  5     low integer := 5;
  6 begin
  7     for k in reverse first..last loop
  8         null;
  9     end loop;
 10     for step in 0..(trunc(high / low) * 2) loop
 11         null;
 12     end loop;
 13     first := last;
 14     insert into bison_pl_issue245_log values('keyword_bounds', first);
 15 end;
 16 /

PL/SQL procedure successfully completed.

SQL>
SQL> declare
  2     type bison_arr is varray(4) of varchar2(10);
  3     team bison_arr := bison_arr();
  4 begin
  5     if team.count = 0 then
  6         insert into bison_pl_issue245_log values('empty_constructor', 0);
  7     end if;
  8 end;
  9 /

PL/SQL procedure successfully completed.

SQL>
SQL> declare
  2     type roster is table of varchar2(15);
  3     names roster := roster('A', 'B');
  4     v varchar2(15);
  5 begin
  6     for i in names.first .. names.last loop
  7         v := names(i);
  8     end loop;
  9     insert into bison_pl_issue245_log values('collection_bounds', names.count);
 10 end;
 11 /

PL/SQL procedure successfully completed.

SQL>
SQL> drop function if exists bison_pl_issue245_return_type;

Succeed.

SQL> drop function if exists bison_pl_issue245_body_type;

Succeed.

SQL> drop table if exists bison_pl_issue245_type_t;

Succeed.

SQL> create table bison_pl_issue245_type_t(id int, note varchar2(20));

Succeed.

SQL> insert into bison_pl_issue245_type_t values(1, 'one');

1 rows affected.

SQL>
SQL> create or replace function bison_pl_issue245_return_type(p_id int)
  2 return bison_pl_issue245_type_t.id%TYPE
  3 is
  4 begin
  5     return p_id;
  6 end;
  7 /

Succeed.

SQL> select bison_pl_issue245_return_type(1) as return_type_result from sys_dummy;

RETURN_TYPE_RESULT
------------------
1

1 rows fetched.

SQL>
SQL> create or replace function bison_pl_issue245_body_type(p_id int)
  2 return int
  3 is
  4     v_id bison_pl_issue245_type_t.id%TYPE;
  5     r bison_pl_issue245_type_t%ROWTYPE;
  6 begin
  7     select * into r from bison_pl_issue245_type_t where id = p_id;
  8     v_id := r.id;
  9     return v_id;
 10 end;
 11 /

Succeed.

SQL> select bison_pl_issue245_body_type(1) as body_type_result from sys_dummy;

BODY_TYPE_RESULT
----------------
1

1 rows fetched.

SQL>
SQL> drop function bison_pl_issue245_return_type;

Succeed.

SQL> drop function bison_pl_issue245_body_type;

Succeed.

SQL> drop table bison_pl_issue245_type_t;

Succeed.

SQL>
SQL> select name, val from bison_pl_issue245_log order by name;

NAME                                     VAL
---------------------------------------- ------------
collection_bounds                        2
empty_constructor                        0
keyword_bounds                           3
pls_integer                              1

4 rows fetched.

SQL>
SQL> drop table if exists bison_pl_issue245_log;

Succeed.

SQL>
SQL> drop function if exists sys.bison_pl_issue259_func_end3;

Succeed.

SQL> create or replace function sys.bison_pl_issue259_func_end3 return number is
  2 begin
  3     return 1;
  4 end sys.bison_pl_issue259_func_end3;
  5 /

Succeed.

SQL> select sys.bison_pl_issue259_func_end3() as issue259_func_end from sys_dummy;

ISSUE259_FUNC_END
----------------------------------------
1

1 rows fetched.

SQL> drop function sys.bison_pl_issue259_func_end3;

Succeed.

SQL>
SQL> drop procedure if exists sys.bison_pl_issue261_proc_end3;

Succeed.

SQL> create or replace procedure sys.bison_pl_issue261_proc_end3 is
  2 begin
  3     null;
  4 end sys.bison_pl_issue261_proc_end3;
  5 /

Succeed.

SQL> drop procedure sys.bison_pl_issue261_proc_end3;

Succeed.

SQL>
SQL> drop trigger if exists bison_pl_issue262_trg;

Succeed.

SQL> drop table if exists bison_pl_issue262_log;

Succeed.

SQL> create table bison_pl_issue262_log(id number, action varchar2(50));

Succeed.

SQL> create or replace trigger bison_pl_issue262_trg
  2 before insert on bison_pl_issue262_log
  3 for each row
  4 declare
  5     v$$ number := 0;
  6 begin
  7     /* outer
  8        /* inner */
  9        :new.not_exists := 1;
 10     */
 11     if :new.id is null then
 12         :new.id := 1;
 13     elsif :new.id < 0 then
 14         :new.id := 0;
 15     end if;
 16     while :new.id < 2 loop
 17         :new.id := :new.id + 1;
 18     end loop;
 19     case
 20         when :new.id = 2 then
 21             v$$ := :new.id;
 22             if v$$ = :new.id then
 23                 :new.action := 'p\' || to_char(:new.id) || '|' || ':new.id' || '|' || $$:old.id$$ || '|' || E'e\':old.id';
 24             else
 25                 :new.action := 'unexpected';
 26             end if;
 27         else
 28             :new.action := 'unexpected';
 29     end case;
 30 end;
 31 /

Succeed.

SQL> insert into bison_pl_issue262_log values(null, 'INSERT');

1 rows affected.

SQL> select id, action from bison_pl_issue262_log;

ID                                       ACTION
---------------------------------------- --------------------------------------------------
2                                        p\2|:new.id|:old.id|e':old.id

1 rows fetched.

SQL> drop trigger bison_pl_issue262_trg;

Succeed.

SQL> drop table bison_pl_issue262_log;

Succeed.

SQL>
SQL> drop trigger if exists bison_pl_issue263_trg;

Succeed.

SQL> drop table if exists bison_pl_issue263_log;

Succeed.

SQL> drop table if exists bison_pl_issue263_basic;

Succeed.

SQL> create table bison_pl_issue263_basic(id number, name varchar2(50));

Succeed.

SQL> create table bison_pl_issue263_log(id number, action varchar2(50));

Succeed.

SQL> create or replace trigger bison_pl_issue263_trg
  2 after update on bison_pl_issue263_basic
  3 for each row
  4 begin
  5     insert into bison_pl_issue263_log values(:old.id, 'UPDATED');
  6     insert into bison_pl_issue263_log values(:old.id, ':new.id');
  7 end;
  8 /

Succeed.

SQL> insert into bison_pl_issue263_basic values(1, 'old');

1 rows affected.

SQL> update bison_pl_issue263_basic set name = 'new' where id = 1;

1 rows affected.

SQL> select id, action from bison_pl_issue263_log order by action;

ID                                       ACTION
---------------------------------------- --------------------------------------------------
1                                        :new.id
1                                        UPDATED

2 rows fetched.

SQL> drop trigger bison_pl_issue263_trg;

Succeed.

SQL> drop table bison_pl_issue263_log;

Succeed.

SQL> drop table bison_pl_issue263_basic;

Succeed.

SQL>
SQL> drop trigger if exists bison_pl_issue266_trg;

Succeed.

SQL> drop view if exists bison_pl_issue266_view;

Succeed.

SQL> drop table if exists bison_pl_issue266_basic;

Succeed.

SQL> create table bison_pl_issue266_basic(id number, name varchar2(50));

Succeed.

SQL> create view bison_pl_issue266_view as select id, name from bison_pl_issue266_basic;

Succeed.

SQL> create or replace trigger bison_pl_issue266_trg
  2 instead of insert on bison_pl_issue266_view
  3 for each row
  4 begin
  5     insert into bison_pl_issue266_basic values(:new.id, :new.name);
  6 end;
  7 /

Succeed.

SQL> insert into bison_pl_issue266_view values(10, 'alice');

1 rows affected.

SQL> select id, name from bison_pl_issue266_basic;

ID                                       NAME
---------------------------------------- --------------------------------------------------
10                                       alice

1 rows fetched.

SQL> drop trigger bison_pl_issue266_trg;

Succeed.

SQL> drop view bison_pl_issue266_view;

Succeed.

SQL> drop table bison_pl_issue266_basic;

Succeed.

SQL>
SQL> drop table if exists bison_pl_pushback_log;

Succeed.

SQL> drop table if exists bison_pl_pushback_src;

Succeed.

SQL> create table bison_pl_pushback_log(stage varchar(40), val int, info varchar(60));

Succeed.

SQL> create table bison_pl_pushback_src(id int, name varchar(20));

Succeed.

SQL> insert into bison_pl_pushback_src values(7, 'PB');

1 rows affected.

SQL>
SQL> declare
  2     type pushback_rec_t is record(id int, name varchar2(20));
  3     type id_tab_t is table of int index by binary_integer;
  4     v_rec pushback_rec_t;
  5     v_ids id_tab_t;
  6     v_id int := 0;
  7     v_name varchar2(20);
  8     cursor c_arg(p_min int, p_name varchar2 default 'PB') is
  9         select id, name from bison_pl_pushback_src where id >= p_min and name = p_name;
 10 begin
 11     v_ids(1) := 11;
 12     bison_pl_proc(v_ids(1));
 13
 14     open c_arg(p_min => 7, p_name => 'PB');
 15     fetch c_arg into v_id, v_name;
 16     close c_arg;
 17     v_rec.id := v_id;
 18     v_rec.name := v_name;
 19
 20     execute immediate 'select id, name from bison_pl_pushback_src where id = :1'
 21         into v_id, v_name using in v_rec.id;
 22
 23     insert into bison_pl_pushback_log values('assoc_type_lookahead', v_ids(1), 'ok');
 24     insert into bison_pl_pushback_log values('cursor_named_arg', v_rec.id, v_rec.name);
 25     insert into bison_pl_pushback_log values('execute_using', v_id, v_name);
 26 end;
 27 /

PL/SQL procedure successfully completed.

SQL>
SQL> select * from bison_pl_pushback_log order by stage;

STAGE                                    VAL          INFO
---------------------------------------- ------------ ------------------------------------------------------------
assoc_type_lookahead                     11           ok
cursor_named_arg                         7            PB
execute_using                            7            PB

3 rows fetched.

SQL>
SQL> drop table if exists bison_pl_pushback_log;

Succeed.

SQL> drop table if exists bison_pl_pushback_src;

Succeed.

SQL>
SQL> drop trigger if exists bison_pl_stmt_trg;

Succeed.

SQL> drop trigger if exists bison_pl_trg;

Succeed.

SQL> drop package body if exists bison_pl_pkg;

Succeed.

SQL> drop package if exists bison_pl_pkg;

Succeed.

SQL> drop function if exists bison_pl_func;

Succeed.

SQL> drop function if exists bison_pl_refcur;

Succeed.

SQL> drop procedure if exists bison_pl_inout_proc;

Succeed.

SQL> drop procedure if exists bison_pl_out_proc;

Succeed.

SQL> drop procedure if exists bison_pl_noarg_proc;

Succeed.

SQL> drop procedure if exists bison_pl_proc;

Succeed.

SQL> drop table if exists bison_pl_src;

Succeed.

SQL> drop table if exists bison_pl_type_t;

Succeed.

SQL> drop table if exists bison_pl_t;

Succeed.

SQL> 


